{
  "$schema": "http://json-schema.org/draft-07/schema#",
  "title": "DeserializableScene",
  "type": "object",
  "required": [
    "ambientLight",
    "camera",
    "lights",
    "objects",
    "skyColor"
  ],
  "properties": {
    "ambientLight": {
      "$ref": "#/definitions/HDRColor"
    },
    "camera": {
      "$ref": "#/definitions/DeserializableCamera"
    },
    "lights": {
      "type": "array",
      "items": {
        "$ref": "#/definitions/DeserializableLight"
      }
    },
    "objects": {
      "type": "array",
      "items": {
        "$ref": "#/definitions/DeserializableRTObject"
      }
    },
    "skyColor": {
      "$ref": "#/definitions/HDRColor"
    }
  },
  "additionalProperties": false,
  "definitions": {
    "DeserializableCamera": {
      "oneOf": [
        {
          "type": "object",
          "required": [
            "fov",
            "fovMode",
            "type"
          ],
          "properties": {
            "direction": {
              "$ref": "#/definitions/Direction"
            },
            "fov": {
              "type": "number",
              "format": "float"
            },
            "fovMode": {
              "$ref": "#/definitions/FovMode"
            },
            "position": {
              "$ref": "#/definitions/Position"
            },
            "type": {
              "type": "string",
              "enum": [
                "perspective"
              ]
            }
          },
          "additionalProperties": false
        }
      ]
    },
    "DeserializableLight": {
      "oneOf": [
        {
          "type": "object",
          "required": [
            "type"
          ],
          "properties": {
            "color": {
              "$ref": "#/definitions/HDRColor"
            },
            "position": {
              "$ref": "#/definitions/Position"
            },
            "type": {
              "type": "string",
              "enum": [
                "point"
              ]
            }
          },
          "additionalProperties": false
        },
        {
          "type": "object",
          "required": [
            "type"
          ],
          "properties": {
            "color": {
              "$ref": "#/definitions/HDRColor"
            },
            "direction": {
              "$ref": "#/definitions/Direction"
            },
            "type": {
              "type": "string",
              "enum": [
                "directional"
              ]
            }
          }
        }
      ]
    },
    "DeserializableRTObject": {
      "oneOf": [
        {
          "type": "object",
          "required": [
            "a",
            "b",
            "type"
          ],
          "properties": {
            "a": {
              "$ref": "#/definitions/DeserializableRTObject"
            },
            "b": {
              "$ref": "#/definitions/DeserializableRTObject"
            },
            "type": {
              "type": "string",
              "enum": [
                "union"
              ]
            }
          },
          "additionalProperties": false
        },
        {
          "type": "object",
          "required": [
            "a",
            "b",
            "type"
          ],
          "properties": {
            "a": {
              "$ref": "#/definitions/DeserializableRTObject"
            },
            "b": {
              "$ref": "#/definitions/DeserializableRTObject"
            },
            "type": {
              "type": "string",
              "enum": [
                "intersection"
              ]
            }
          },
          "additionalProperties": false
        },
        {
          "type": "object",
          "required": [
            "a",
            "b",
            "type"
          ],
          "properties": {
            "a": {
              "$ref": "#/definitions/DeserializableRTObject"
            },
            "b": {
              "$ref": "#/definitions/DeserializableRTObject"
            },
            "type": {
              "type": "string",
              "enum": [
                "difference"
              ]
            }
          },
          "additionalProperties": false
        },
        {
          "type": "object",
          "required": [
            "type"
          ],
          "properties": {
            "albedo": {
              "$ref": "#/definitions/LDRColor"
            },
            "position": {
              "$ref": "#/definitions/Position"
            },
            "radius": {
              "default": 1.0,
              "type": "number",
              "format": "float"
            },
            "type": {
              "type": "string",
              "enum": [
                "sphere"
              ]
            }
          },
          "additionalProperties": false
        },
        {
          "type": "object",
          "required": [
            "type"
          ],
          "properties": {
            "albedo": {
              "$ref": "#/definitions/LDRColor"
            },
            "normal": {
              "$ref": "#/definitions/Direction"
            },
            "position": {
              "$ref": "#/definitions/Position"
            },
            "type": {
              "type": "string",
              "enum": [
                "plane"
              ]
            }
          },
          "additionalProperties": false
        },
        {
          "type": "object",
          "required": [
            "type"
          ],
          "properties": {
            "albedo": {
              "$ref": "#/definitions/LDRColor"
            },
            "position": {
              "$ref": "#/definitions/Position"
            },
            "scale": {
              "$ref": "#/definitions/Scale"
            },
            "type": {
              "type": "string",
              "enum": [
                "cube"
              ]
            }
          },
          "additionalProperties": false
        },
        {
          "type": "object",
          "required": [
            "type"
          ],
          "properties": {
            "albedo": {
              "$ref": "#/definitions/LDRColor"
            },
            "c000": {
              "default": 0.0,
              "type": "number",
              "format": "float"
            },
            "c001": {
              "default": 0.0,
              "type": "number",
              "format": "float"
            },
            "c002": {
              "default": 0.0,
              "type": "number",
              "format": "float"
            },
            "c010": {
              "default": 0.0,
              "type": "number",
              "format": "float"
            },
            "c011": {
              "default": 0.0,
              "type": "number",
              "format": "float"
            },
            "c020": {
              "default": 0.0,
              "type": "number",
              "format": "float"
            },
            "c100": {
              "default": 0.0,
              "type": "number",
              "format": "float"
            },
            "c101": {
              "default": 0.0,
              "type": "number",
              "format": "float"
            },
            "c110": {
              "default": 0.0,
              "type": "number",
              "format": "float"
            },
            "c200": {
              "default": 0.0,
              "type": "number",
              "format": "float"
            },
            "inside": {
              "$ref": "#/definitions/Position"
            },
            "position": {
              "$ref": "#/definitions/Position"
            },
            "type": {
              "type": "string",
              "enum": [
                "quadric"
              ]
            }
          },
          "additionalProperties": false
        },
        {
          "type": "object",
          "required": [
            "inside",
            "type"
          ],
          "properties": {
            "albedo": {
              "$ref": "#/definitions/LDRColor"
            },
            "c000": {
              "default": 0.0,
              "type": "number",
              "format": "float"
            },
            "c001": {
              "default": 0.0,
              "type": "number",
              "format": "float"
            },
            "c002": {
              "default": 0.0,
              "type": "number",
              "format": "float"
            },
            "c003": {
              "default": 0.0,
              "type": "number",
              "format": "float"
            },
            "c010": {
              "default": 0.0,
              "type": "number",
              "format": "float"
            },
            "c011": {
              "default": 0.0,
              "type": "number",
              "format": "float"
            },
            "c012": {
              "default": 0.0,
              "type": "number",
              "format": "float"
            },
            "c020": {
              "default": 0.0,
              "type": "number",
              "format": "float"
            },
            "c021": {
              "default": 0.0,
              "type": "number",
              "format": "float"
            },
            "c030": {
              "default": 0.0,
              "type": "number",
              "format": "float"
            },
            "c100": {
              "default": 0.0,
              "type": "number",
              "format": "float"
            },
            "c101": {
              "default": 0.0,
              "type": "number",
              "format": "float"
            },
            "c102": {
              "default": 0.0,
              "type": "number",
              "format": "float"
            },
            "c110": {
              "default": 0.0,
              "type": "number",
              "format": "float"
            },
            "c111": {
              "default": 0.0,
              "type": "number",
              "format": "float"
            },
            "c120": {
              "default": 0.0,
              "type": "number",
              "format": "float"
            },
            "c200": {
              "default": 0.0,
              "type": "number",
              "format": "float"
            },
            "c201": {
              "default": 0.0,
              "type": "number",
              "format": "float"
            },
            "c210": {
              "default": 0.0,
              "type": "number",
              "format": "float"
            },
            "c300": {
              "default": 0.0,
              "type": "number",
              "format": "float"
            },
            "inside": {
              "$ref": "#/definitions/Position"
            },
            "position": {
              "$ref": "#/definitions/Position"
            },
            "type": {
              "type": "string",
              "enum": [
                "quadratic"
              ]
            }
          }
        }
      ]
    },
    "Direction": {
      "title": "Direction",
      "description": "A 3D normal, either as an object `{x, y, z}` or a tuple `[x, y, z]`.",
      "oneOf": [
        {
          "type": "object",
          "required": [
            "x",
            "y",
            "z"
          ],
          "properties": {
            "x": {
              "type": "number",
              "format": "float"
            },
            "y": {
              "type": "number",
              "format": "float"
            },
            "z": {
              "type": "number",
              "format": "float"
            }
          },
          "additionalProperties": false
        },
        {
          "type": "array",
          "items": {
            "type": "number",
            "format": "float"
          },
          "maxItems": 3,
          "minItems": 3
        }
      ]
    },
    "FovMode": {
      "oneOf": [
        {
          "type": "object",
          "required": [
            "type"
          ],
          "properties": {
            "type": {
              "type": "string",
              "enum": [
                "x"
              ]
            }
          },
          "additionalProperties": false
        },
        {
          "type": "object",
          "required": [
            "type"
          ],
          "properties": {
            "type": {
              "type": "string",
              "enum": [
                "y"
              ]
            }
          },
          "additionalProperties": false
        },
        {
          "type": "object",
          "required": [
            "aspectRatio",
            "type"
          ],
          "properties": {
            "aspectRatio": {
              "type": "number",
              "format": "float"
            },
            "type": {
              "type": "string",
              "enum": [
                "cover"
              ]
            }
          },
          "additionalProperties": false
        },
        {
          "type": "object",
          "required": [
            "aspectRatio",
            "type"
          ],
          "properties": {
            "aspectRatio": {
              "type": "number",
              "format": "float"
            },
            "type": {
              "type": "string",
              "enum": [
                "contain"
              ]
            }
          },
          "additionalProperties": false
        }
      ]
    },
    "HDRColor": {
      "title": "HDRColor",
      "description": "A HDR color, either as an object `{r, g, b}` or a tuple `[r, g, b]`.",
      "oneOf": [
        {
          "type": "object",
          "required": [
            "b",
            "g",
            "r"
          ],
          "properties": {
            "b": {
              "type": "number",
              "format": "float",
              "minimum": 0.0
            },
            "g": {
              "type": "number",
              "format": "float",
              "minimum": 0.0
            },
            "r": {
              "type": "number",
              "format": "float",
              "minimum": 0.0
            }
          },
          "additionalProperties": false
        },
        {
          "type": "array",
          "items": {
            "type": "number",
            "format": "float",
            "minimum": 0.0
          },
          "maxItems": 3,
          "minItems": 3
        }
      ]
    },
    "LDRColor": {
      "title": "LDRColor",
      "description": "A LDR color, either as an object `{r, g, b}` or a tuple `[r, g, b]`.",
      "oneOf": [
        {
          "type": "object",
          "required": [
            "b",
            "g",
            "r"
          ],
          "properties": {
            "b": {
              "type": "number",
              "format": "float",
              "maximum": 1.0,
              "minimum": 0.0
            },
            "g": {
              "type": "number",
              "format": "float",
              "maximum": 1.0,
              "minimum": 0.0
            },
            "r": {
              "type": "number",
              "format": "float",
              "maximum": 1.0,
              "minimum": 0.0
            }
          },
          "additionalProperties": false
        },
        {
          "type": "array",
          "items": {
            "type": "number",
            "format": "float",
            "maximum": 1.0,
            "minimum": 0.0
          },
          "maxItems": 3,
          "minItems": 3
        }
      ]
    },
    "Position": {
      "title": "Position",
      "description": "A 3D position, either as an object `{x, y, z}` or a tuple `[x, y, z]`.",
      "oneOf": [
        {
          "type": "object",
          "required": [
            "x",
            "y",
            "z"
          ],
          "properties": {
            "x": {
              "type": "number",
              "format": "float"
            },
            "y": {
              "type": "number",
              "format": "float"
            },
            "z": {
              "type": "number",
              "format": "float"
            }
          },
          "additionalProperties": false
        },
        {
          "type": "array",
          "items": {
            "type": "number",
            "format": "float"
          },
          "maxItems": 3,
          "minItems": 3
        }
      ]
    },
    "Scale": {
      "title": "Scale",
      "description": "A 3D scale, either as an object `{x, y, z}` or a tuple `[x, y, z]`.",
      "oneOf": [
        {
          "type": "object",
          "required": [
            "x",
            "y",
            "z"
          ],
          "properties": {
            "x": {
              "type": "number",
              "format": "float",
              "minimum": 0.0
            },
            "y": {
              "type": "number",
              "format": "float",
              "minimum": 0.0
            },
            "z": {
              "type": "number",
              "format": "float",
              "minimum": 0.0
            }
          },
          "additionalProperties": false
        },
        {
          "type": "array",
          "items": {
            "type": "number",
            "format": "float",
            "minimum": 0.0
          },
          "maxItems": 3,
          "minItems": 3
        }
      ]
    }
  }
}