{
  "camera": {
    "type": "perspective",
    "fov": 90,
    "fovMode": {
      "type": "cover",
      "aspectRatio": 1.7777777777
    },
    "position": [0, -10, 0],
    "direction": [0, 1, 0]
  },
  "objects": [
    {
      "type": "difference",
      "a": {
        "type": "intersection",
        "a": {
          "type": "sphere",
          "position": [-2, 0, -3],
          "radius": 1.33,
          "albedo": [0.2, 0.2, 1]
        },
        "b": {
          "type": "cube",
          "position": [-2, 0, -3],
          "scale": [1, 1, 1],
          "albedo": [1, 0.2, 0.2]
        }
      },
      "b": {
        "type": "sphere",
        "position": [-2, 0, -3],
        "radius": 1.2,
        "albedo": [0.2, 1, 0.2]
      }
    },
    {
      "type": "difference",
      "a": {
        "type": "intersection",
        "a": {
          "type": "sphere",
          "position": [2, 0, -3],
          "radius": 1.33,
          "albedo": [0.2, 0.2, 1]
        },
        "b": {
          "type": "cube",
          "position": [2, 0, -3],
          "scale": [1, 1, 1],
          "albedo": [1, 0.2, 0.2]
        }
      },
      "b": {
        "type": "sphere",
        "position": [2, 0, -3],
        "radius": 1.2,
        "albedo": [0.2, 1, 0.2]
      }
    },
    {
      "type": "plane",
      "position": [0, 0, -5],
      "normal": [0, 0, 1],
      "albedo": [1, 1, 1]
    },
    {
      "type": "sphere",
      "position": [-3, 0, 0],
      "radius": 1,
      "albedo": [1, 0.5, 0.5]
    },
    {
      "type": "sphere",
      "position": [0, 0, 0],
      "radius": 1,
      "albedo": [0.5, 1, 0.5]
    },
    {
      "type": "cube",
      "position": [3, 0, 0],
      "scale": [1, 1, 1],
      "albedo": [0.5, 0.5, 1]
    }
  ],
  "lights": [
    {
      "type": "point",
      "position": [0, 0, 14],
      "color": [20, 20, 20]
    }
  ],
  "skyColor": [0.1, 0.11, 0.2],
  "ambientLight": [0.1, 0.1, 0.1]
}
